[{"_id":"31d55dc21fc2f6c91720dae3","temp":"absolute","duration":20.066106166442236,"syncIdentifier":"09b8a64c66b9446b97bce7ed571c7863b6a2656134c3e453c101be3a31fa8bed67f1","insulinType":"Humalog","eventType":"Temp Basal","rate":3,"amount":1,"automatic":true,"created_at":"2026-01-02T02:46:24.000Z","timestamp":"2026-01-02T02:46:24Z","absolute":3,"enteredBy":"loop://iPhone","utcOffset":0,"carbs":null,"insulin":null},{"_id":"6fc7e52b193427a2c02e6567","syncIdentifier":"df8284a19e38f7a0448b52b7b69aae00d956bd190a0ad492115f80aa17679c","timestamp":"2026-01-02T02:26:41Z","eventType":"Correction Bolus","type":"normal","programmed":3.05,"unabsorbed":0,"enteredBy":"loop://iPhone","insulinType":"Humalog","automatic":false,"duration":2.033333333333333,"insulin":3.05,"created_at":"2026-01-02T02:26:41.000Z","utcOffset":0,"carbs":null},{"_id":"6f8d7267c585a70d11ce0248","temp":"absolute","insulinType":"Humalog","duration":20.023057983318964,"absolute":3,"syncIdentifier":"d0ad0d09210e160bcd9c4a555f211623228ef1fb77c8940fbfc1086c34887dd55bc5","enteredBy":"loop://iPhone","automatic":true,"eventType":"Temp Basal","created_at":"2026-01-02T02:26:23.000Z","amount":1,"timestamp":"2026-01-02T02:26:23Z","rate":3,"utcOffset":0,"carbs":null,"insulin":null},{"_id":"6565356f8b903bd514f3410e","enteredBy":"loop://iPhone","syncIdentifier":"08c34e54946e3c466f7cc7c45931d0b280f09d8dac9e01bba4a2f09628debf190ca0","created_at":"2026-01-02T02:06:22.000Z","temp":"absolute","insulinType":"Humalog","amount":1,"timestamp":"2026-01-02T02:06:22Z","eventType":"Temp Basal","duration":20.012737133105595,"automatic":true,"rate":3,"absolute":3,"utcOffset":0,"carbs":null,"insulin":null},{"_id":"24b27417d8030c6952875df5","automatic":true,"created_at":"2026-01-02T01:46:23.000Z","syncIdentifier":"9d50048208b237f8663df18ef1340d5e76f385b0fb175af27894b801b13f5d84c5e9","enteredBy":"loop://iPhone","rate":3,"insulinType":"Humalog","eventType":"Temp Basal","absolute":3,"amount":0.95,"temp":"absolute","duration":19.984660349289577,"timestamp":"2026-01-02T01:46:23Z","utcOffset":0,"carbs":null,"insulin":null},{"_id":"875aab97691ae4c5b6fec55b","eventType":"Temp Basal","rate":3,"amount":1,"automatic":true,"syncIdentifier":"ab45ad851dc233877f1d1e93b31b638d0ab314050d9402fe7f73e83ab6fba07d3d9e","timestamp":"2026-01-02T01:26:22Z","temp":"absolute","created_at":"2026-01-02T01:26:22.000Z","insulinType":"Humalog","absolute":3,"duration":20.00918286641439,"enteredBy":"loop://iPhone","utcOffset":0,"carbs":null,"insulin":null},{"_id":"5641d4f907462e08fdbe2d13","duration":5.003187032540639,"timestamp":"2026-01-02T01:21:22Z","syncIdentifier":"a59753e63e4b1a6499d4b27b36a50348de276422805d50f4903a45b8d6996ad316d579","enteredBy":"loop://iPhone","created_at":"2026-01-02T01:21:22.000Z","insulinType":"Humalog","eventType":"Temp Basal","absolute":1.5,"amount":0.1,"rate":1.5,"automatic":true,"temp":"absolute","utcOffset":0,"carbs":null,"insulin":null},{"_id":"ebd0f5e6df25c3d9ba29694f","rate":1.5,"created_at":"2026-01-02T01:01:26.000Z","duration":19.929532132546107,"syncIdentifier":"7bc22828252144be32ac433fcb10e720bb94c68c542eea205a50b6e53f64e97f7f70f4","amount":0.45,"insulinType":"Humalog","timestamp":"2026-01-02T01:01:26Z","automatic":true,"enteredBy":"loop://iPhone","temp":"absolute","eventType":"Temp Basal","absolute":1.5,"utcOffset":0,"carbs":null,"insulin":null},{"_id":"FADDFA05-584E-39F4-135D-E783550A12F7","enteredBy":"Loop","timestamp":"2026-01-02T01:00:47Z","eventType":"Temporary Override","created_at":"2026-01-02T01:00:47.000Z","reason":"Label 1","insulinNeedsScaleFactor":2,"correctionRange":[90.07794000002704,162.14029200004867],"duration":90,"utcOffset":0,"carbs":null,"insulin":null},{"_id":"57864d588de4e79a82c73eb3","timestamp":"2026-01-02T00:56:22Z","amount":0.1,"temp":"absolute","eventType":"Temp Basal","enteredBy":"loop://iPhone","created_at":"2026-01-02T00:56:22.000Z","duration":5.0774725834528605,"automatic":true,"insulinType":"Humalog","absolute":1.7,"rate":1.7,"syncIdentifier":"9c9f4a40fb253f636d6d7e44970a4e97926a58f912494942a7e4caab2ee144e78fde9b","utcOffset":0,"carbs":null,"insulin":null},{"_id":"1f6dcfa341d5818e5bc8a77e","insulinType":"Humalog","eventType":"Temp Basal","timestamp":"2026-01-02T00:51:23Z","syncIdentifier":"eea0c3ecf5aae0b8072e569b0a86a57fed25c81d3f9ba094affab5a3843464df47cb71ee","temp":"absolute","rate":1.75,"duration":4.979634183645248,"amount":0.1,"automatic":true,"absolute":1.75,"created_at":"2026-01-02T00:51:23.000Z","enteredBy":"loop://iPhone","utcOffset":0,"carbs":null,"insulin":null},{"_id":"499155a4019a152063948f20","timestamp":"2026-01-02T00:37:51Z","insulin":7.15,"duration":4.766666666666667,"automatic":false,"programmed":7.15,"syncIdentifier":"fb0d7d10a870ce1c6af9804578442e0131bf000a87e16d2367b2f9e2b48dc6","type":"normal","unabsorbed":0,"enteredBy":"loop://iPhone","insulinType":"Humalog","eventType":"Correction Bolus","created_at":"2026-01-02T00:37:51.000Z","utcOffset":0,"carbs":null},{"_id":"b364ebfa347d2740715a4821","created_at":"2026-01-02T00:37:45.000Z","timestamp":"2026-01-02T00:37:45Z","enteredBy":"loop://iPhone","eventType":"Site Change","notes":"Label 2","utcOffset":0,"carbs":null,"insulin":null},{"_id":"f9801f8ddd96d7348de3fbc8","temp":"absolute","enteredBy":"loop://iPhone","rate":0,"eventType":"Temp Basal","timestamp":"2026-01-01T21:17:26Z","syncIdentifier":"c1b8c67a706197a5b724eabaf32125db20a8977eb9ff05387ab88060df9fdebf","absolute":0,"reason":"Label 3","duration":200.1242590824763,"automatic":true,"created_at":"2026-01-01T21:17:26.000Z","utcOffset":0,"carbs":null,"insulin":null},{"_id":"0a23bece25d5fb0fde9182bd","enteredBy":"loop://iPhone","insulinType":"Humalog","created_at":"2026-01-01T21:16:22.000Z","absolute":3,"syncIdentifier":"c975104c713c614ebb8f7bd4c5548388781e8538dc4c9811d3f654412138ef3f1276","timestamp":"2026-01-01T21:16:22Z","duration":1.0602350334326427,"amount":0.05,"temp":"absolute","automatic":true,"eventType":"Temp Basal","rate":3,"utcOffset":0,"carbs":null,"insulin":null},{"_id":"4126f2d5619c0e69d0995f3f","enteredBy":"loop://iPhone","rate":2.7,"absolute":2.7,"amount":0.2,"automatic":true,"syncIdentifier":"62dc665da73b44a8a0fd368740046ad892553c8955621c8eee63ee1399c5c6ebf099c0","eventType":"Temp Basal","insulinType":"Humalog","timestamp":"2026-01-01T21:11:23Z","created_at":"2026-01-01T21:11:23.000Z","temp":"absolute","duration":4.984497433900833,"utcOffset":0,"carbs":null,"insulin":null},{"_id":"9ce5874977934b1ad9302978","duration":5.011252866188685,"syncIdentifier":"8661f3d575b399a808110cb323b9692c5fa4cd7aaf37e0674795f369ccd5d90ba80a02f7","temp":"absolute","rate":1.95,"amount":0.15,"absolute":1.95,"eventType":"Temp Basal","timestamp":"2026-01-01T21:06:22Z","automatic":true,"insulinType":"Humalog","created_at":"2026-01-01T21:06:22.000Z","enteredBy":"loop://iPhone","utcOffset":0,"carbs":null,"insulin":null},{"_id":"a802840c7802e0090233c3dd","duration":4.914207633336385,"temp":"absolute","timestamp":"2026-01-01T21:01:27Z","syncIdentifier":"5eaa156679f479792fdd479bcccf0c2808b0645a74b63a5a04316a662ea62fb884177153","amount":0.15,"insulinType":"Humalog","automatic":true,"created_at":"2026-01-01T21:01:27.000Z","eventType":"Temp Basal","rate":2.15,"absolute":2.15,"enteredBy":"loop://iPhone","utcOffset":0,"carbs":null,"insulin":null},{"_id":"b915f289f7c4e0992b5bb5fc","insulinType":"Humalog","duration":5.088183033466339,"enteredBy":"loop://iPhone","eventType":"Temp Basal","rate":1.6,"amount":0.1,"syncIdentifier":"5b6349c63f03bf18232c0b3d8ccb89632cb5060a9fc6d6c9a22758a9d089432f3f2c","temp":"absolute","absolute":1.6,"automatic":true,"timestamp":"2026-01-01T20:56:22Z","created_at":"2026-01-01T20:56:22.000Z","utcOffset":0,"carbs":null,"insulin":null},{"_id":"7af2b29e2ec39e46763550e0","insulinType":"Humalog","syncIdentifier":"24d7a9a80da6205ff76c52f90a9c81bd1e49cb6731af4f9b81e337b35a371a25775736","eventType":"Temp Basal","timestamp":"2026-01-01T20:51:22Z","enteredBy":"loop://iPhone","temp":"absolute","rate":1.7,"absolute":1.7,"duration":5.005936467647553,"created_at":"2026-01-01T20:51:22.000Z","amount":0.1,"automatic":true,"utcOffset":0,"carbs":null,"insulin":null},{"_id":"7ef8a5e0a1d46cd768904468","rate":0,"created_at":"2026-01-01T20:36:23.000Z","duration":9.954785299301147,"syncIdentifier":"96a1414e39756de764dde311210bf26e329312a677b0c7249fb8438560933f2bf74c","amount":0,"insulinType":"Humalog","timestamp":"2026-01-01T20:36:23Z","automatic":true,"enteredBy":"loop://iPhone","temp":"absolute","eventType":"Temp Basal","absolute":0,"utcOffset":0,"carbs":null,"insulin":null},{"_id":"67ad735807d759dc74bf130b","enteredBy":"loop://iPhone","eventType":"Temp Basal","syncIdentifier":"cca094901b3af6c2b9509fc899978b92e6ee1b7c6e56fa1306b8d7055bd8e1c24364","amount":0,"temp":"absolute","rate":0,"timestamp":"2026-01-01T20:16:22Z","duration":20.02351539929708,"automatic":true,"created_at":"2026-01-01T20:16:22.000Z","insulinType":"Humalog","absolute":0,"utcOffset":0,"carbs":null,"insulin":null},{"_id":"af6ed4e4a1388951f5230967","insulinType":"Humalog","eventType":"Temp Basal","enteredBy":"loop://iPhone","duration":4.970935215552648,"amount":0.05,"created_at":"2026-01-01T20:11:24.000Z","rate":1.2,"timestamp":"2026-01-01T20:11:24Z","syncIdentifier":"fc16ceda6ac16afe0c8c469e55cf8af83958e4a0c06888bbaa19483bb0d946ddb06c","absolute":1.2,"temp":"absolute","automatic":true,"utcOffset":0,"carbs":null,"insulin":null},{"_id":"dbbde26f26793dcc911bf272","temp":"absolute","timestamp":"2026-01-01T20:01:23Z","created_at":"2026-01-01T20:01:23.000Z","insulinType":"Humalog","enteredBy":"loop://iPhone","amount":0,"syncIdentifier":"0e7cceef7b8f7ca52e4482a714d9d8aaeac2682899ab679453352e1b5c75154e799b","absolute":0,"rate":0,"duration":5.012746250629425,"automatic":true,"eventType":"Temp Basal","utcOffset":0,"carbs":null,"insulin":null},{"_id":"49dfcfd34edeb2d24d0eda75","created_at":"2026-01-01T19:56:22.000Z","syncIdentifier":"c2cf7be21d3b003822f066a0837de0b80decd2b406811e14afdaa7cfa982eb7d6eb0","eventType":"Temp Basal","rate":1.8,"amount":0.15,"absolute":1.8,"enteredBy":"loop://iPh